B1: Wins | C1: Loss | D1: Win % | E1: Open Trades | F1: Take Profit | G1: Stop Loss | H1: Statement Equity
A2: Hendrick | B2: 26 | C2: 3 | D2: =B2/(B2+C2) -> 0.89655172413793105 | E2: 3 | F2: 18 | G2: 42 | H2: 5577.24
A3: Mono | B3: 126 | C3: 1 | D3: =B3/(B3+C3) -> 0.99212598425196852 | E3: 18 | F3: 30 | G3: 300 | H3: 7942.65

A1: Week | B1: Opened | C1: Closed | D1: Opened | E1: Pips
D2: & Closed | E2: Booked
A3: W1 | B3: 56 | C3: 43 | D3: 55 | E3: 1320
A4: W2 | B4: 48 | C4: 43 | D4: 48 | E4: 1230
A5: W3 | B5: 41 | C5: 42 | D5: 41 | E5: 930
A6: W4 | B6: 42 | C6: 45 | D6: 31 | E6: 1350
A7: W5 | B7: 41 | C7: 37 | D7: 28 | E7: 1110
A8: W6 | B8: 51 | C8: 50 | D8: 37 | E8: 1500
A10: Total | E10: =SUM(E3:E8) -> 7440
A11: AVG | E11: =E10/6 -> 1240

B1: Trades | C1: Winners | D1: Losers | E1: Percent | F1: Profit/Loss | G1: Estimated Float | H1: Net+/-
A2: usd/chf | B2: 13 | C2: 13 | D2: 0 | E2: =C2/B2 -> 1 | F2: 390.00000000000148 | G2: -11 | H2: =SUM(F2:G2) -> 379.00000000000148
A3: aud/usd | B3: 7 | C3: 7 | D3: 0 | E3: =C3/B3 -> 1 | F3: 210 | G3: -48 | H3: =SUM(F3:G3) -> 162
A4: eur/jpy | B4: 3 | C4: 3 | D4: 0 | E4: =C4/B4 -> 1 | F4: 89.999999999994884 | G4: -110 | H4: =SUM(F4:G4) -> -20.000000000005116
A5: gbp/usd | B5: 17 | C5: 15 | D5: 2 | E5: =C5/B5 -> 0.88235294117647056 | F5: -156.00000000000506 | G5: -336 | H5: =SUM(F5:G5) -> -492.00000000000506
A6: eur/usd | B6: 15 | C6: 15 | D6: 0 | E6: =C6/B6 -> 1 | F6: 448.99999999999721 | G6: 0 | H6: =SUM(F6:G6) -> 448.99999999999721
A7: aud/jpy | B7: 0 | C7: 0 | D7: 0 | E7: =C7/B7 -> #DIV/0! | F7: 0 | G7: -115 | H7: =SUM(F7:G7) -> -115
A8: usd/cad | B8: 8 | C8: 8 | D8: 0 | E8: =C8/B8 -> 1 | F8: 239 | G8: -108 | H8: =SUM(F8:G8) -> 131
A9: eur/gbp | B9: 0 | C9: 0 | D9: 0 | E9: =C9/B9 -> #DIV/0! | F9: 0 | G9: -112 | H9: =SUM(F9:G9) -> -112
A10: usd/jpy | B10: 6 | C10: 6 | D10: 0 | E10: =C10/B10 -> 1 | F10: 180.00000000000114 | G10: -24 | H10: =SUM(F10:G10) -> 156.00000000000114
A11: eur/chf | B11: 4 | C11: 4 | D11: 0 | E11: =C11/B11 -> 1 | F11: 119 | G11: 18 | H11: =SUM(F11:G11) -> 137
B12: =SUM(B2:B11) -> 73 | C12: =SUM(C2:C11) -> 71 | D12: =SUM(D211) -> 2 | F12: =SUM(F2:F11) -> 1520.9999999999905 | G12: =SUM(G2:G11) -> -846 | H12: =SUM(H2:H11) -> 674.99999999999045

B1: Trades | C1: Winners | D1: Losers | E1: Percent | F1: Profit/Loss | G1: Estimated Float | H1: Net+/-
A2: aud/jpy | B2: 1 | C2: 1 | D2: 0 | E2: =C2/B2 -> 1 | F2: 30.000000000001137 | G2: -187 | H2: =SUM(F2:G2) -> -156.99999999999886
A3: aud/usd | B3: 9 | C3: 9 | D3: 0 | E3: =C3/B3 -> 1 | F3: 270 | G3: -25 | H3: =SUM(F3:G3) -> 245
A4: eur/chf | B4: 5 | C4: 5 | D4: 0 | E4: =C4/B4 -> 1 | F4: 149.00000000000136 | G4: -5 | H4: =SUM(F4:G4) -> 144.00000000000136
A5: eur/gbp | B5: 0 | C5: 0 | D5: 0 | E5: =C5/B5 -> #DIV/0! | F5: 0 | G5: -154 | H5: =SUM(F5:G5) -> -154
A6: eur/jpy | B6: 4 | C6: 4 | D6: 0 | E6: =C6/B6 -> 1 | F6: 119.99999999999318 | G6: -274 | H6: =SUM(F6:G6) -> -154.00000000000682
A7: eur/usd | B7: 18 | C7: 18 | D7: 0 | E7: =C7/B7 -> 1 | F7: 535.99999999999648 | G7: -233 | H7: =SUM(F7:G7) -> 302.99999999999648
A8: gbp/usd | B8: 27 | C8: 25 | D8: 2 | E8: =C8/B8 -> 0.92592592592592593 | F8: 143.999999999995 | G8: 3 | H8: =SUM(F8:G8) -> 146.999999999995
A9: usd/cad | B9: 14 | C9: 14 | D9: 0 | E9: =C9/B9 -> 1 | F9: 418.99999999999829 | G9: 23 | H9: =SUM(F9:G9) -> 441.99999999999829
A10: usd/chf | B10: 18 | C10: 18 | D10: 0 | E10: =C10/B10 -> 1 | F10: 539.99999999999829 | G10: -213 | H10: =SUM(F10:G10) -> 326.99999999999829
A11: usd/jpy | B11: 6 | C11: 6 | D11: 0 | E11: =C11/B11 -> 1 | F11: 180.00000000000114 | G11: -499 | H11: =SUM(F11:G11) -> -318.99999999999886
B12: =SUM(B2:B11) -> 102 | C12: =SUM(C2:C11) -> 100 | D12: =SUM(D211) -> 2 | F12: =SUM(F2:F11) -> 2387.9999999999845 | G12: =SUM(G2:G11) -> -1564 | H12: =SUM(H2:H11) -> 823.99999999998522

B1: Trades | C1: Winners | D1: Losers | E1: Percent | F1: Profit/Loss | G1: Estimated Float | H1: Net+/-
A2: aud/jpy | B2: 1 | C2: 1 | D2: 0 | E2: =C2/B2 -> 1 | F2: 30.000000000001137 | G2: -275 | H2: =SUM(F2:G2) -> -244.99999999999886
A3: aud/usd | B3: 10 | C3: 10 | D3: 0 | E3: =C3/B3 -> 1 | F3: 300 | G3: 0 | H3: =SUM(F3:G3) -> 300
A4: eur/chf | B4: 5 | C4: 5 | D4: 0 | E4: =C4/B4 -> 1 | F4: 149.00000000000136 | G4: -49 | H4: =SUM(F4:G4) -> 100.00000000000136
A5: eur/gbp | B5: 0 | C5: 0 | D5: 0 | E5: =C5/B5 -> #DIV/0! | F5: 0 | G5: -103 | H5: =SUM(F5:G5) -> -103
A6: eur/jpy | B6: 4 | C6: 4 | D6: 0 | E6: =C6/B6 -> 1 | F6: 119.99999999999318 | G6: -274 | H6: =SUM(F6:G6) -> -154.00000000000682
A7: eur/usd | B7: 20 | C7: 20 | D7: 0 | E7: =C7/B7 -> 1 | F7: 595.9999999999942 | G7: -85 | H7: =SUM(F7:G7) -> 510.9999999999942
A8: gbp/usd | B8: 29 | C8: 27 | D8: 2 | E8: =C8/B8 -> 0.93103448275862066 | F8: 203.999999999995 | G8: 11 | H8: =SUM(F8:G8) -> 214.999999999995
A9: usd/cad | B9: 16 | C9: 16 | D9: 0 | E9: =C9/B9 -> 1 | F9: 479.00000000000057 | G9: -69 | H9: =SUM(F9:G9) -> 410.00000000000057
A10: usd/chf | B10: 20 | C10: 20 | D10: 0 | E10: =C10/B10 -> 1 | F10: 598.99999999999841 | G10: -123 | H10: =SUM(F10:G10) -> 475.99999999999841
A11: usd/jpy | B11: 7 | C11: 7 | D11: 0 | E11: =C11/B11 -> 1 | F11: 210.00000000000085 | G11: -339 | H11: =SUM(F11:G11) -> -128.99999999999915
B12: =SUM(B2:B11) -> 112 | C12: =SUM(C2:C11) -> 110 | D12: =SUM(D211) -> 2 | F12: =SUM(F2:F11) -> 2686.9999999999845 | G12: =SUM(G2:G11) -> -1306 | H12: =SUM(H2:H11) -> 1380.999999999985

B1: Trades | C1: Winners | D1: Losers | E1: Percent | F1: Profit/Loss | G1: Estimated Float | H1: Net+/-
A2: aud/jpy | B2: 2 | C2: 2 | D2: 0 | E2: =C2/B2 -> 1 | F2: 60.000000000000853 | G2: -251 | H2: =SUM(F2:G2) -> -190.99999999999915
A3: aud/usd | B3: 10 | C3: 10 | D3: 0 | E3: =C3/B3 -> 1 | F3: 300 | G3: 2 | H3: =SUM(F3:G3) -> 302
A4: eur/chf | B4: 6 | C4: 6 | D4: 0 | E4: =C4/B4 -> 1 | F4: 179 | G4: -13 | H4: =SUM(F4:G4) -> 166
A5: eur/gbp | B5: 0 | C5: 0 | D5: 0 | E5: =C5/B5 -> #DIV/0! | F5: 0 | G5: -37 | H5: =SUM(F5:G5) -> -37
A6: eur/jpy | B6: 4 | C6: 4 | D6: 0 | E6: =C6/B6 -> 1 | F6: 119.99999999999318 | G6: -335 | H6: =SUM(F6:G6) -> -215.00000000000682
A7: eur/usd | B7: 22 | C7: 22 | D7: 0 | E7: =C7/B7 -> 1 | F7: 655.99999999999193 | G7: 6 | H7: =SUM(F7:G7) -> 661.99999999999193
A8: gbp/usd | B8: 33 | C8: 31 | D8: 2 | E8: =C8/B8 -> 0.93939393939393945 | F8: 323.999999999995 | G8: -30 | H8: =SUM(F8:G8) -> 293.999999999995
A9: usd/cad | B9: 16 | C9: 16 | D9: 0 | E9: =C9/B9 -> 1 | F9: 479.00000000000057 | G9: -128 | H9: =SUM(F9:G9) -> 351.00000000000057
A10: usd/chf | B10: 24 | C10: 24 | D10: 0 | E10: =C10/B10 -> 1 | F10: 718.99999999999613 | G10: 11 | H10: =SUM(F10:G10) -> 729.99999999999613
A11: usd/jpy | B11: 7 | C11: 7 | D11: 0 | E11: =C11/B11 -> 1 | F11: 210.00000000000085 | G11: -225 | H11: =SUM(F11:G11) -> -14.999999999999147
B12: =SUM(B2:B11) -> 124 | C12: =SUM(C2:C11) -> 122 | D12: =SUM(D211) -> 2 | F12: =SUM(F2:F11) -> 3046.9999999999791 | G12: =SUM(G2:G11) -> -1000 | H12: =SUM(H2:H11) -> 2046.9999999999791

A1: 2367128 | B1: 2006.08.24 18:55 | C1: sell | D1: 0.57 | E1: usdchf | F1: 1.2378 | G1: 1.2367999999999999 | H1: 1.2347999999999999 | I1: 2006.08.28 07:20 | J1: 1.2367999999999999 | K1: 0.00 | L1: 0.00 | M1: -13.30 | N1: 46.09

A1: 2367128 | B1: 2006.08.24 18:55 | C1: sell | D1: 0.57 | E1: usdchf | F1: 1.2378 | G1: 1.2367999999999999 | H1: 1.2347999999999999 | I1: 2006.08.28 07:20 | J1: 1.2367999999999999 | K1: 0.00 | L1: 0.00 | M1: -13.30 | N1: 46.09

A1: Originally Posted by blewmoon Here is my update for the last 5 weeks with a real account. 125 trades, 124 wins with my first loss [Swissy]. Trading with 63G on Mono's setting except for the TS set on 20 now. My pairs are still the same [see earlier post]. Graph enc. showing the account from $5 K to over $6k in that time. BTW; If my S/L was 315 [instead of 300] I would have been OK in this trade. 5 mins after beeing stopped out, the market turned back down.... But that's trading!!

A1: Open Trades:
A2: Ticket | B2: Open Time | C2: Type | D2: Lots | E2: Item | F2: Price | G2: S / L | H2: T / P | J2: Price | K2: Commission | L2: Taxes | M2: Swap | N2: Profit
A3: 10840798 | B3: 2006.10.04 06:23 | C3: sell | D3: 0.10 | E3: audusdm | F3: 0.7442 | G3: 0.7743 | H3: 0.7393 | J3: 0.7461 | K3: 0.00 | L3: 0.00 | M3: -0.05 | N3: -1.90
A4: 10848342 | B4: 2006.10.04 09:29 | C4: sell | D4: 0.10 | E4: eurchfm | F4: 1.5876 | G4: 1.6176 | H4: 1.5826 | J4: 1.5893 | K4: 0.00 | L4: 0.00 | M4: -0.19 | N4: -1.36
A5: 10831130 | B5: 2006.10.03 17:52 | C5: buy | D5: 0.10 | E5: eurgbpm | F5: 0.6746 | G5: 0.6446 | H5: 0.6796 | J5: 0.6752 | K5: 0.00 | L5: 0.00 | M5: -0.28 | N5: 1.13
A6: 10904881 | B6: 2006.10.05 13:15 | C6: buy | D6: 0.10 | E6: eurusdm | F6: 1.2694 | G6: 1.2394 | H6: 1.2744 | J6: 1.2689 | K6: 0.00 | L6: 0.00 | M6: 0.00 | N6: -0.50
A7: 10831129 | B7: 2006.10.03 17:51 | C7: sell | D7: 0.10 | E7: usdcadm | F7: 1.1202 | G7: 1.1502 | H7: 1.1152 | J7: 1.1261 | K7: 0.00 | L7: 0.00 | M7: -0.13 | N7: -5.24
A8: 10841230 | B8: 2006.10.04 06:45 | C8: sell | D8: 0.10 | E8: usdcadm | F8: 1.1246 | G8: 1.1546 | H8: 1.1196 | J8: 1.1261 | K8: 0.00 | L8: 0.00 | M8: -0.10 | N8: -1.33
A9: 10837663 | B9: 2006.10.04 01:54 | C9: sell | D9: 0.10 | E9: usdchfm | F9: 1.2468 | G9: 1.2768 | H9: 1.2418 | J9: 1.2527 | K9: 0.00 | L9: 0.00 | M9: -0.35 | N9: -4.71
A10: 10847996 | B10: 2006.10.04 09:17 | C10: sell | D10: 0.10 | E10: usdchfm | F10: 1.2507 | G10: 1.2808 | H10: 1.2458 | J10: 1.2527 | K10: 0.00 | L10: 0.00 | M10: -0.35 | N10: -1.60
A11: 10842507 | B11: 2006.10.04 07:19 | C11: buy | D11: 0.10 | E11: usdjpym | F11: 117.90 | G11: 114.90 | H11: 118.40 | J11: 117.64 | K11: 0.00 | L11: 0.00 | M11: 0.39 | N11: -2.21
K12: 0.00 | L12: 0.00 | M12: -1.06 | N12: -17.72
K13: Floating P/L: | M13: -18.78

A1: Open Trades:
A2: Ticket | B2: Open Time | C2: Type | D2: Lots | E2: Item | F2: Price | G2: S / L | H2: T / P | J2: Price | K2: Commission | L2: Taxes | M2: Swap | N2: Profit
A3: 10840798 | B3: 2006.10.04 06:23 | C3: sell | D3: 0.10 | E3: audusdm | F3: 0.7442 | G3: 0.7743 | H3: 0.7393 | J3: 0.7431 | K3: 0.00 | L3: 0.00 | M3: -0.05 | N3: 1.10
A4: 10848342 | B4: 2006.10.04 09:29 | C4: sell | D4: 0.10 | E4: eurchfm | F4: 1.5876 | G4: 1.6176 | H4: 1.5826 | J4: 1.5886 | K4: 0.00 | L4: 0.00 | M4: -0.19 | N4: -0.79
A5: 10831130 | B5: 2006.10.03 17:52 | C5: buy | D5: 0.10 | E5: eurgbpm | F5: 0.6746 | G5: 0.6446 | H5: 0.6796 | J5: 0.6732 | K5: 0.00 | L5: 0.00 | M5: -0.28 | N5: -2.62
A6: 10904881 | B6: 2006.10.05 13:15 | C6: buy | D6: 0.10 | E6: eurusdm | F6: 1.2694 | G6: 1.2394 | H6: 1.2744 | J6: 1.2593 | K6: 0.00 | L6: 0.00 | M6: 0.00 | N6: -10.10
A7: 10831129 | B7: 2006.10.03 17:51 | C7: sell | D7: 0.10 | E7: usdcadm | F7: 1.1202 | G7: 1.1502 | H7: 1.1152 | J7: 1.1272 | K7: 0.00 | L7: 0.00 | M7: -0.13 | N7: -6.21
A8: 10841230 | B8: 2006.10.04 06:45 | C8: sell | D8: 0.10 | E8: usdcadm | F8: 1.1246 | G8: 1.1546 | H8: 1.1196 | J8: 1.1272 | K8: 0.00 | L8: 0.00 | M8: -0.10 | N8: -2.31
A9: 10837663 | B9: 2006.10.04 01:54 | C9: sell | D9: 0.10 | E9: usdchfm | F9: 1.2468 | G9: 1.2768 | H9: 1.2418 | J9: 1.2614 | K9: 0.00 | L9: 0.00 | M9: -0.35 | N9: -11.57
A10: 10847996 | B10: 2006.10.04 09:17 | C10: sell | D10: 0.10 | E10: usdchfm | F10: 1.2507 | G10: 1.2808 | H10: 1.2458 | J10: 1.2614 | K10: 0.00 | L10: 0.00 | M10: -0.35 | N10: -8.48
A11: 10941820 | B11: 2006.10.06 12:33 | C11: sell | D11: 0.10 | E11: usdchfm | F11: 1.2549 | G11: 1.2849 | H11: 1.2499 | J11: 1.2614 | K11: 0.00 | L11: 0.00 | M11: 0.00 | N11: -5.15
A12: 10944410 | B12: 2006.10.06 12:40 | C12: buy | D12: 0.10 | E12: eurusdm | F12: 1.2650 | G12: 1.2350 | H12: 1.2700 | J12: 1.2593 | K12: 0.00 | L12: 0.00 | M12: 0.00 | N12: -5.70
A13: 10952196 | B13: 2006.10.06 13:20 | C13: sell | D13: 0.10 | E13: usdchfm | F13: 1.2606 | G13: 1.2906 | H13: 1.2556 | J13: 1.2614 | K13: 0.00 | L13: 0.00 | M13: 0.00 | N13: -0.63
K14: 0.00 | L14: 0.00 | M14: -1.45 | N14: -52.46
K15: Floating P/L: | M15: -53.91